id,create_task_commands,task_titles
0,please create task happy break,Happy break
1,Create daily scrum meeting task,Daily scrum meeting
2,Please create meeting with customer for next year task,Meeting with customer for next year
3,Please create log out put to file task,Log out put to file
4,Create task fix bugs on Sprint one,Fix bugs on Sprint one
5,Create task deploy latest version of AI Model api to vps,Deploy latest version of AI Model api to vps
6,Create task research audio model,Research audio model